{
  "$schema": "http://json-schema.org/draft-07/schema#",
  "type": "object",
  "properties": {
    "mapName": {
      "type": "string",
      "description": "The name of the entire map"
    },
    "mapId": {
      "type": "string",
      "description": "Unique identifier for the map"
    },
    "totalRooms": {
      "type": "integer",
      "minimum": 1,
      "description": "The total number of rooms in the map"
    },
    "rooms": {
      "type": "array",
      "items": {
        "type": "object",
        "properties": {
          "id": {
            "type": "string",
            "description": "Unique identifier for the room"
          },
          "name": {
            "type": "string",
            "description": "Name of the room"
          },
          "connections": {
            "type": "array",
            "items": {
              "type": "string"
            },
            "description": "Array of room IDs that this room is directly connected to"
          },
          "coordinates": {
            "type": "string",
            "description": "Grid coordinates (e.g., 'X0Y1')"
          }
        },
        "required": ["id", "name", "connections", "coordinates"]
      },
      "minItems": 1,
      "description": "Array of room objects in the map"
    },
    "layout": {
      "type": "array",
      "items": {
        "type": "array",
        "items": {
          "type": "string"
        }
      },
      "description": "2D array representing the spatial layout of the rooms"
    }
  },
  "required": ["mapName", "mapId", "totalRooms", "rooms", "layout"]
}