{
  "mapId": "MAP_TBM001",
  "mapName": "Blighted Marches Map",
  "totalRooms": 6,
  "rooms": [
    {
      "id": "R01",
      "name": "The Sundered Causeway",
      "type": "ruins",
      "connections": [
        "R02",
        "R03"
      ],
      "coordinates": "X1Y1"
    },
    {
      "id": "R02",
      "name": "The Mire of Echoes",
      "type": "bog",
      "connections": [
        "R01",
        "R04",
        "R05"
      ],
      "coordinates": "X2Y1"
    },
    {
      "id": "R03",
      "name": "Abandoned Watchtower",
      "type": "tower",
      "connections": [
        "R01",
        "R06"
      ],
      "coordinates": "X1Y2"
    },
    {
      "id": "R04",
      "name": "Black Banner Encampment",
      "type": "camp",
      "connections": [
        "R02",
        "R05"
      ],
      "coordinates": "X3Y1"
    },
    {
      "id": "R05",
      "name": "Ancient Standing Stones",
      "type": "ritual",
      "connections": [
        "R02",
        "R04",
        "R06"
      ],
      "coordinates": "X2Y2"
    },
    {
      "id": "R06",
      "name": "The Cursed Barrow",
      "type": "tomb",
      "connections": [
        "R03",
        "R05"
      ],
      "coordinates": "X3Y2"
    }
  ],
  "layout": [
    [
      "R01",
      "R02",
      "R04"
    ],
    [
      "R03",
      "R05",
      "R06"
    ]
  ]
}