{
  "mapId": "MAP_6",
  "mapName": "Dungeon Map",
  "totalRooms": 6,
  "rooms": [
    {
      "id": "WR01",
      "name": "Shrine R01",
      "type": "shrine",
      "connections": [
        "WR02",
        "WR03"
      ],
      "coordinates": "X2Y2"
    },
    {
      "id": "WR02",
      "name": "Vault R02",
      "type": "vault",
      "connections": [
        "WR01",
        "WR04"
      ],
      "coordinates": "X2Y3"
    },
    {
      "id": "WR03",
      "name": "Chamber R03",
      "type": "chamber",
      "connections": [
        "WR01",
        "WR05"
      ],
      "coordinates": "X1Y2"
    },
    {
      "id": "WR04",
      "name": "Laboratory R04",
      "type": "laboratory",
      "connections": [
        "WR02",
        "WR06"
      ],
      "coordinates": "X2Y4"
    },
    {
      "id": "WR05",
      "name": "Corridor R05",
      "type": "corridor",
      "connections": [
        "WR03"
      ],
      "coordinates": "X1Y1"
    },
    {
      "id": "WR06",
      "name": "Chamber R06",
      "type": "chamber",
      "connections": [
        "WR04"
      ],
      "coordinates": "X1Y4"
    }
  ],
  "layout": [
    [
      "WR05",
      "   "
    ],
    [
      "WR03",
      "WR01"
    ],
    [
      "   ",
      "WR02"
    ],
    [
      "WR06",
      "WR04"
    ]
  ]
}