{
  "mapId": "MAP_4",
  "mapName": "Town Map",
  "totalRooms": 4,
  "rooms": [
    {
      "id": "R01",
      "type": "barracks",
      "connections": [
        "R02",
        "R04"
      ],
      "coordinates": "X2Y2",
      "name": "Wardens' Vigil Hall"
    },
    {
      "id": "R02",
      "type": "tavern",
      "connections": [
        "R01",
        "R03"
      ],
      "coordinates": "X2Y3",
      "name": "The Restful Quiver"
    },
    {
      "id": "R03",
      "type": "square",
      "connections": [
        "R02"
      ],
      "coordinates": "X2Y4",
      "name": "Oaken Lantern Square"
    },
    {
      "id": "R04",
      "type": "square",
      "connections": [
        "R01"
      ],
      "coordinates": "X1Y2",
      "name": "Shadowsend Crossing"
    }
  ],
  "layout": [
    [
      "R04",
      "R01"
    ],
    [
      "   ",
      "R02"
    ],
    [
      "   ",
      "R03"
    ]
  ]
}