{
  "mapId": "MAP_6",
  "mapName": "Town Map",
  "totalRooms": 6,
  "rooms": [
    {
      "id": "R01",
      "type": "tavern",
      "connections": [
        "R02",
        "R06"
      ],
      "coordinates": "X2Y2",
      "name": "The Black Lantern Hearth"
    },
    {
      "id": "R02",
      "type": "barracks",
      "connections": [
        "R01",
        "R03",
        "R05"
      ],
      "coordinates": "X2Y1",
      "name": "Shroudwatch Garrison"
    },
    {
      "id": "R03",
      "type": "barracks",
      "connections": [
        "R02",
        "R04"
      ],
      "coordinates": "X2Y0",
      "name": "Salt-Scoured Bunks"
    },
    {
      "id": "R04",
      "type": "barracks",
      "connections": [
        "R03",
        "R05"
      ],
      "coordinates": "X3Y0",
      "name": "Drowned Warden Quarters"
    },
    {
      "id": "R05",
      "type": "temple",
      "connections": [
        "R02",
        "R04",
        "R06"
      ],
      "coordinates": "X3Y1",
      "name": "Sanctum of Sable Flames"
    },
    {
      "id": "R06",
      "type": "gate",
      "connections": [
        "R01",
        "R05"
      ],
      "coordinates": "X3Y2",
      "name": "Tideworn Gate"
    }
  ],
  "layout": [
    [
      "R03",
      "R04"
    ],
    [
      "R02",
      "R05"
    ],
    [
      "R01",
      "R06"
    ]
  ]
}