{
  "mapId": "MAP_5",
  "mapName": "Wilderness Map",
  "totalRooms": 5,
  "rooms": [
    {
      "id": "RO01",
      "type": "crossroads",
      "connections": [
        "RO02",
        "RO03",
        "RO04"
      ],
      "coordinates": "X2Y2",
      "name": "Forked Trails Crossing"
    },
    {
      "id": "RO02",
      "type": "riverside",
      "connections": [
        "RO01"
      ],
      "coordinates": "X2Y3",
      "name": "Moonlit Waters Edge"
    },
    {
      "id": "RO03",
      "type": "ruins",
      "connections": [
        "RO01",
        "RO05"
      ],
      "coordinates": "X1Y2",
      "name": "Shattered Sentinel Stones"
    },
    {
      "id": "RO04",
      "type": "riverside",
      "connections": [
        "RO01"
      ],
      "coordinates": "X3Y2",
      "name": "Mistshadow Ford"
    },
    {
      "id": "RO05",
      "type": "ruins",
      "connections": [
        "RO03"
      ],
      "coordinates": "X1Y1",
      "name": "Forgotten Waystation"
    }
  ],
  "layout": [
    [
      "RO05",
      "   ",
      "   "
    ],
    [
      "RO03",
      "RO01",
      "RO04"
    ],
    [
      "   ",
      "RO02",
      "   "
    ]
  ]
}