{
    "mapName": "Dwarven Complex - First Floor",
    "mapId": "DS001",
    "totalRooms": 10,
    "rooms": [
      {
        "id": "D1",
        "name": "Grand Entrance Hall",
        "connections": ["EM001-R14", "D2", "D3", "D6", "D10", "D8"],
        "coordinates": "X1Y7"
      },
      {
        "id": "D2",
        "name": "Guardians' Chamber",
        "connections": ["D1", "D4", "D7"],
        "coordinates": "X0Y7"
      },
      {
        "id": "D3",
        "name": "Hall of Records",
        "connections": ["D1", "D5"],
        "coordinates": "X2Y7"
      },
      {
        "id": "D4",
        "name": "Elemental Attunement Chamber",
        "connections": ["D2"],
        "coordinates": "X0Y8"
      },
      {
        "id": "D5",
        "name": "Apprentice Forges",
        "connections": ["D3"],
        "coordinates": "X2Y8"
      },
      {
        "id": "D6",
        "name": "Residential Quarter Entrance",
        "connections": ["D1", "D9"],
        "coordinates": "X1Y8"
      },
      {
        "id": "D7",
        "name": "Artifact Containment Vault",
        "connections": ["D2"],
        "coordinates": "X0Y6"
      },
      {
        "id": "D8",
        "name": "Water Purification System",
        "connections": ["D1"],
        "coordinates": "X2Y6"
      },
      {
        "id": "D9",
        "name": "Emergency Escape Tunnel",
        "connections": ["D6"],
        "coordinates": "X1Y9"
      },
      {
        "id": "D10",
        "name": "Ceremonial Chamber",
        "connections": ["D1"],
        "coordinates": "X0Y9"
      }
    ],
    "layout": [
      ["", "", "", "D9", "", ""],
      ["D4", "D10", "D6", "", "D5", ""],
      ["D2", "D1", "", "", "D3", ""],
      ["D7", "", "EM001-R14", "", "D8", ""]
    ]
  }