{
  "mapId": "MAP_5",
  "mapName": "Town Map",
  "totalRooms": 5,
  "rooms": [
    {
      "id": "A01",
      "name": "Harrow's Hollow General Store",
      "type": "shop",
      "connections": [
        "A02",
        "A03",
        "A04",
        "A05"
      ],
      "coordinates": "X2Y2"
    },
    {
      "id": "A02",
      "name": "Harrow's Hollow Town Square",
      "type": "square",
      "connections": [
        "A01"
      ],
      "coordinates": "X3Y2"
    },
    {
      "id": "A03",
      "name": "East Gate and Guardhouse",
      "type": "gate",
      "connections": [
        "A01"
      ],
      "coordinates": "X2Y3"
    },
    {
      "id": "A04",
      "name": "Militia Barracks",
      "type": "barracks",
      "connections": [
        "A01"
      ],
      "coordinates": "X2Y1"
    },
    {
      "id": "A05",
      "name": "The Wyrd Lantern Inn",
      "type": "tavern",
      "connections": [
        "A01"
      ],
      "coordinates": "X1Y2"
    }
  ],
  "layout": [
    [
      "   ",
      "A04",
      "   "
    ],
    [
      "A05",
      "A01",
      "A02"
    ],
    [
      "   ",
      "A03",
      "   "
    ]
  ]
}