{
  "mapId": "MAP_TBM001",
  "mapName": "Blighted Marches Map",
  "totalRooms": 6,
  "rooms": [
    {
      "id": "D01",
      "name": "The Sundered Causeway",
      "type": "ruins",
      "connections": [
        "D02",
        "D03"
      ],
      "coordinates": "X1Y1"
    },
    {
      "id": "D02",
      "name": "The Mire of Echoes",
      "type": "bog",
      "connections": [
        "D01",
        "D04",
        "D05"
      ],
      "coordinates": "X2Y1"
    },
    {
      "id": "D03",
      "name": "Abandoned Watchtower",
      "type": "tower",
      "connections": [
        "D01",
        "D06"
      ],
      "coordinates": "X1Y2"
    },
    {
      "id": "D04",
      "name": "Black Banner Encampment",
      "type": "camp",
      "connections": [
        "D02",
        "D05"
      ],
      "coordinates": "X3Y1"
    },
    {
      "id": "D05",
      "name": "Ancient Standing Stones",
      "type": "ritual",
      "connections": [
        "D02",
        "D04",
        "D06"
      ],
      "coordinates": "X2Y2"
    },
    {
      "id": "D06",
      "name": "The Cursed Barrow",
      "type": "tomb",
      "connections": [
        "D03",
        "D05"
      ],
      "coordinates": "X3Y2"
    }
  ],
  "layout": [
    [
      "D01",
      "D02",
      "D04"
    ],
    [
      "D03",
      "D05",
      "D06"
    ]
  ]
}